{
  "baseFingerprint": "4409bdca90edbb1fcae9aff7c928cc8991a16f322e222eb5b4b60b6075ecf5eb",
  "baseUpdatedAt": "2026-02-12T02:06:51.338Z",
  "ops": [
    {
      "op": "set",
      "path": "strings.nav.widgets",
      "value": "ウィジェット"
    },
    {
      "op": "set",
      "path": "strings.nav.viewAllWidgets",
      "value": "すべてのウィジェットを見る"
    },
    {
      "op": "set",
      "path": "strings.tabs.overview",
      "value": "概要"
    },
    {
      "op": "set",
      "path": "strings.tabs.templates",
      "value": "テンプレート"
    },
    {
      "op": "set",
      "path": "strings.tabs.examples",
      "value": "例"
    },
    {
      "op": "set",
      "path": "strings.tabs.features",
      "value": "機能"
    },
    {
      "op": "set",
      "path": "strings.tabs.pricing",
      "value": "料金"
    },
    {
      "op": "set",
      "path": "strings.cta.createFree",
      "value": "無料で作成"
    },
    {
      "op": "set",
      "path": "strings.cta.seeTemplates",
      "value": "テンプレートを見る"
    },
    {
      "op": "set",
      "path": "strings.common.comingSoon",
      "value": "近日公開。"
    },
    {
      "op": "set",
      "path": "strings.creative.useThisWidgetOnYourWebsite",
      "value": "このウィジェットをあなたのサイトで使う"
    },
    {
      "op": "set",
      "path": "strings.localeShowcase.title",
      "value": "あらゆる言語に対応する設計"
    },
    {
      "op": "set",
      "path": "strings.localeShowcase.subtitle",
      "value": "厳選された同じウィジェット。3つのロケール。1つのコードパス。"
    },
    {
      "op": "set",
      "path": "strings.share.share",
      "value": "共有"
    },
    {
      "op": "set",
      "path": "strings.share.copy",
      "value": "リンクをコピー"
    },
    {
      "op": "set",
      "path": "strings.share.copied",
      "value": "コピーしました"
    },
    {
      "op": "set",
      "path": "strings.share.more",
      "value": "もっと見る"
    },
    {
      "op": "set",
      "path": "strings.share.sms",
      "value": "SMS"
    },
    {
      "op": "set",
      "path": "strings.share.email",
      "value": "メール"
    },
    {
      "op": "set",
      "path": "strings.share.whatsapp",
      "value": "WhatsApp"
    },
    {
      "op": "set",
      "path": "strings.share.telegram",
      "value": "Telegram"
    },
    {
      "op": "set",
      "path": "strings.share.signal",
      "value": "Signal"
    },
    {
      "op": "set",
      "path": "strings.share.messenger",
      "value": "Messenger"
    },
    {
      "op": "set",
      "path": "strings.share.wechat",
      "value": "WeChat"
    },
    {
      "op": "set",
      "path": "strings.share.line",
      "value": "LINE"
    },
    {
      "op": "set",
      "path": "strings.share.slack",
      "value": "Slack"
    },
    {
      "op": "set",
      "path": "strings.share.teams",
      "value": "Teams"
    },
    {
      "op": "set",
      "path": "strings.share.discord",
      "value": "Discord"
    },
    {
      "op": "set",
      "path": "strings.share.x",
      "value": "X"
    },
    {
      "op": "set",
      "path": "strings.share.linkedin",
      "value": "LinkedIn"
    },
    {
      "op": "set",
      "path": "strings.share.facebook",
      "value": "Facebook"
    },
    {
      "op": "set",
      "path": "strings.share.reddit",
      "value": "Reddit"
    },
    {
      "op": "set",
      "path": "strings.share.instagram",
      "value": "Instagram"
    },
    {
      "op": "set",
      "path": "strings.share.tiktok",
      "value": "TikTok"
    },
    {
      "op": "set",
      "path": "strings.share.title",
      "value": "Clickeen ウィジェット"
    },
    {
      "op": "set",
      "path": "strings.share.text",
      "value": "このウィジェットをあなたのサイトで使いましょう。"
    },
    {
      "op": "set",
      "path": "strings.share.sectionMessageTitle",
      "value": "このウィジェットテンプレートをメッセージで送信"
    },
    {
      "op": "set",
      "path": "strings.share.sectionSocialTitle",
      "value": "このウィジェットテンプレートをSNSで共有"
    },
    {
      "op": "set",
      "path": "strings.footer.brand",
      "value": "Clickeen"
    },
    {
      "op": "set",
      "path": "strings.footer.pricing",
      "value": "料金"
    },
    {
      "op": "set",
      "path": "strings.footer.widgets",
      "value": "ウィジェット"
    },
    {
      "op": "set",
      "path": "strings.footer.rights",
      "value": "All rights reserved."
    }
  ],
  "v": 1
}
