{
  "baseFingerprint": "d65ff042131f29be42433be84f075eee4959e6a37745cb68c4284d915b0d1102",
  "baseUpdatedAt": "2026-02-09T22:02:20.222161+00:00",
  "ops": [
    {
      "op": "set",
      "path": "sections.0.title",
      "value": "Todas las Preguntas"
    },
    {
      "op": "set",
      "path": "sections.0.faqs.0.question",
      "value": "¿Qué es Clickeen?"
    },
    {
      "op": "set",
      "path": "sections.0.faqs.1.question",
      "value": "¿Cómo instalo un widget?"
    },
    {
      "op": "set",
      "path": "sections.0.faqs.2.question",
      "value": "¿Hay un plan gratuito?"
    },
    {
      "op": "set",
      "path": "sections.0.faqs.3.question",
      "value": "¿Por qué debería usar Clickeen?"
    },
    {
      "op": "set",
      "path": "sections.0.faqs.0.answer",
      "value": "Clickeen proporciona widgets hermosos, integrables y enfocados en la conversión que son fáciles de configurar y están diseñados para mejorar la interacción del usuario en tu sitio. <strong>Comienza a construir gratis hoy mismo.</strong>"
    },
    {
      "op": "set",
      "path": "sections.0.faqs.1.answer",
      "value": "Simplemente copia el código de inserción desde tu panel de control y pégalo antes de la etiqueta de cierre en tu sitio web. <strong>Inténtalo ahora—no se requiere tarjeta de crédito.</strong>"
    },
    {
      "op": "set",
      "path": "sections.0.faqs.2.answer",
      "value": "Sí, nuestro plan gratuito incluye un widget activo con funciones básicas para que comiences. <strong>Actualiza en cualquier momento para desbloquear widgets ilimitados y análisis avanzados.</strong>"
    },
    {
      "op": "set",
      "path": "sections.0.faqs.3.answer",
      "value": "Clickeen hace que tu presencia web sea hermosa, fácil de buscar y amigable para el usuario con widgets que son simples de gestionar y optimizados para conversiones. <strong>Únete a miles de creadores satisfechos y aumenta tu participación.</strong>"
    },
    {
      "op": "set",
      "path": "cta.label",
      "value": "Contáctanos"
    },
    {
      "op": "set",
      "path": "header.subtitleHtml",
      "value": "Diseño elegante, actualizaciones fáciles y elementos esenciales de SEO, listo para cualquier idioma."
    },
    {
      "op": "set",
      "path": "header.title",
      "value": "Preguntas Frecuentes"
    }
  ],
  "v": 1
}
