{
  "baseFingerprint": "58308bf57aa30b9a176bc6230f8855b4cf93cba3ed46fd4034e2e1a7edf6cb50",
  "baseUpdatedAt": "2026-02-11T23:19:56.282307+00:00",
  "ops": [
    {
      "op": "set",
      "path": "cta.label",
      "value": "Book nu"
    },
    {
      "op": "set",
      "path": "header.subtitleHtml",
      "value": "Oplev charmen og komforten på vores B&B i USA."
    },
    {
      "op": "set",
      "path": "header.title",
      "value": "FAQ om Bed and Breakfast"
    },
    {
      "op": "set",
      "path": "sections.0.faqs.0.answer",
      "value": "Vi tilbyder et udvalg af værelser, herunder <a href=\"https://www.clickeen.com/\" class=\"diet-dropdown-edit-link\"></a><a href=\"https://www.clickeen.com/\" class=\"diet-dropdown-edit-link\"></a><a href=\"https://www.clickeen.com/\" class=\"diet-dropdown-edit-link\">standard</a> , <a href=\"https://www.clickeen.com/\" class=\"diet-dropdown-edit-link\"></a><a href=\"https://www.clickeen.com/\" class=\"diet-dropdown-edit-link\"></a><a href=\"https://www.clickeen.com/\" class=\"diet-dropdown-edit-link\">deluxe</a> og <a href=\"https://www.clickeen.com/\" class=\"diet-dropdown-edit-link\"></a><a href=\"https://www.clickeen.com/\" class=\"diet-dropdown-edit-link\"></a><a href=\"https://www.clickeen.com/\" class=\"diet-dropdown-edit-link\">suiter</a> ."
    },
    {
      "op": "set",
      "path": "sections.0.faqs.0.question",
      "value": "Hvilke værelsestyper findes der?"
    },
    {
      "op": "set",
      "path": "sections.0.faqs.1.answer",
      "value": "Check-in er kl. 15.00, og check-out senest kl. 11.00."
    },
    {
      "op": "set",
      "path": "sections.0.faqs.1.question",
      "value": "Hvornår er check-in og check-out?"
    },
    {
      "op": "set",
      "path": "sections.0.faqs.2.answer",
      "value": "Ja, der er gratis morgenmad inkluderet i dit ophold."
    },
    {
      "op": "set",
      "path": "sections.0.faqs.2.question",
      "value": "Er morgenmad inkluderet?"
    },
    {
      "op": "set",
      "path": "sections.0.faqs.3.answer",
      "value": "Ja, vi tilbyder romantiske <a href=\"https://www.clickeen.com/\" class=\"diet-dropdown-edit-link\"></a><a href=\"https://www.clickeen.com/\" class=\"diet-dropdown-edit-link\"></a><a href=\"https://www.clickeen.com/\" class=\"diet-dropdown-edit-link\">getaway-pakker</a> samt <a href=\"https://www.clickeen.com/\" class=\"diet-dropdown-edit-link\"></a><a href=\"https://www.clickeen.com/\" class=\"diet-dropdown-edit-link\"></a><a href=\"https://www.clickeen.com/\" class=\"diet-dropdown-edit-link\">familievenlige muligheder.</a>"
    },
    {
      "op": "set",
      "path": "sections.0.faqs.3.question",
      "value": "Tilbyder I særlige pakker?"
    },
    {
      "op": "set",
      "path": "sections.0.title",
      "value": "Ofte stillede spørgsmål"
    }
  ],
  "v": 1
}
