{
  "baseFingerprint": "40438fa9dfb9e87f82979157116e9d8c1badfa5fa57f139d3228e22b37f915e0",
  "baseUpdatedAt": "2026-01-21T02:59:11.496Z",
  "ops": [
    {
      "op": "set",
      "path": "blocks.hero.copy.headline",
      "value": "FAQテンプレート"
    },
    {
      "op": "set",
      "path": "blocks.hero.copy.subheadline",
      "value": "実績のあるレイアウトから始めて、ブランドに合わせて調整しましょう。"
    },
    {
      "op": "set",
      "path": "blocks.page-meta.copy.description",
      "value": "FAQテンプレートを確認し、実績のあるレイアウトから始めましょう。"
    },
    {
      "op": "set",
      "path": "blocks.page-meta.copy.title",
      "value": "FAQテンプレート - Clickeen"
    }
  ],
  "v": 1
}
