{
  "baseFingerprint": "8195a1d10f47c5b7f0fe175273741fea4544f526d218b1e02aa79c5e1d8d270b",
  "baseUpdatedAt": "2026-01-24T00:19:35.064Z",
  "ops": [
    {
      "op": "set",
      "path": "blocks.page-meta.copy.title",
      "value": "Mga Template ng Logo Showcase - Clickeen"
    },
    {
      "op": "set",
      "path": "blocks.page-meta.copy.description",
      "value": "Magsimula sa isang pinakintab na layout at i-customize ang iyong logo showcase."
    },
    {
      "op": "set",
      "path": "blocks.hero.copy.headline",
      "value": "Mga Template ng Showcase ng Logo"
    },
    {
      "op": "set",
      "path": "blocks.hero.copy.subheadline",
      "value": "Magsimula sa isang pulidong layout -- tapos gawin itong sa iyo."
    }
  ],
  "v": 1
}
