{
  "baseFingerprint": "907d70eb3d744fbba9632aa9244692f15994efa80fc9bb04159813031d62d884",
  "baseUpdatedAt": "2026-02-02T19:19:14.178626+00:00",
  "ops": [
    {
      "op": "set",
      "path": "sections.0.title",
      "value": "Domande generali"
    },
    {
      "op": "set",
      "path": "sections.0.faqs.0.question",
      "value": "Cos'è Clickeen?"
    },
    {
      "op": "set",
      "path": "sections.0.faqs.1.question",
      "value": "C'è un piano gratuito?"
    },
    {
      "op": "set",
      "path": "sections.0.faqs.2.question",
      "value": "Come installo un widget?"
    },
    {
      "op": "set",
      "path": "sections.0.faqs.3.question",
      "value": "Perché dovrei usare Clickeen"
    },
    {
      "op": "set",
      "path": "sections.0.faqs.0.answer",
      "value": "Clickeen è qualcosa che renderà Margherita molto molto ricca"
    },
    {
      "op": "set",
      "path": "sections.0.faqs.1.answer",
      "value": "Sì, un widget attivo con funzionalità principali."
    },
    {
      "op": "set",
      "path": "sections.0.faqs.2.answer",
      "value": "Copia il codice di incorporamento e incollalo prima di </body> sul tuo sito."
    },
    {
      "op": "set",
      "path": "sections.0.faqs.3.answer",
      "value": "Perché Clickeen è una nuova piattaforma straordinaria per rendere il web bello e facile da usare."
    },
    {
      "op": "set",
      "path": "cta.label",
      "value": "Contattaci"
    },
    {
      "op": "set",
      "path": "header.subtitleHtml",
      "value": "Design raffinato, aggiornamenti semplici e basi SEO—pronto per qualsiasi lingua."
    },
    {
      "op": "set",
      "path": "header.title",
      "value": "Domande Frequenti"
    }
  ],
  "v": 1
}
