{
  "baseFingerprint": "bc3713c1679f30566425f5e661ad7a2fd7d462d4621b87398a4f21f4d5891090",
  "baseUpdatedAt": "2026-02-06T23:05:33.556Z",
  "ops": [
    {
      "op": "set",
      "path": "blocks.page-meta.copy.title",
      "value": "FAQ-functies - Clickeen"
    },
    {
      "op": "set",
      "path": "blocks.page-meta.copy.description",
      "value": "De definitieve antwoordmachine. Snelheid, SEO en AI ingebouwd."
    },
    {
      "op": "set",
      "path": "blocks.hero.copy.headline",
      "value": "De antwoordmachine"
    },
    {
      "op": "set",
      "path": "blocks.hero.copy.subheadline",
      "value": "Snelheid. SEO-sectie. AI. De definitieve FAQ-infrastructuur."
    },
    {
      "op": "set",
      "path": "blocks.split-ai.copy.headline",
      "value": "Schrijf niet. Beschrijf gewoon."
    },
    {
      "op": "set",
      "path": "blocks.split-ai.copy.subheadline",
      "value": "Bewerken in natuurlijke taal, aangedreven door Ombra."
    },
    {
      "op": "set",
      "path": "blocks.split-global.copy.headline",
      "value": "29 talen. Eén schakelaar."
    },
    {
      "op": "set",
      "path": "blocks.split-global.copy.subheadline",
      "value": "Geografie is slechts een parameter."
    },
    {
      "op": "set",
      "path": "blocks.split-composable.copy.headline",
      "value": "Schrijf één keer. Draai overal."
    },
    {
      "op": "set",
      "path": "blocks.split-composable.copy.subheadline",
      "value": "Eén bron van waarheid."
    },
    {
      "op": "set",
      "path": "blocks.steps-diff.copy.title",
      "value": "Waarom Clickeen alles verandert"
    },
    {
      "op": "set",
      "path": "blocks.steps-diff.copy.items.0.title",
      "value": "Google ziet elk woord"
    },
    {
      "op": "set",
      "path": "blocks.steps-diff.copy.items.1.title",
      "value": "Rich snippets"
    },
    {
      "op": "set",
      "path": "blocks.steps-diff.copy.items.2.title",
      "value": "Diepe links"
    },
    {
      "op": "set",
      "path": "blocks.steps-diff.copy.items.0.body",
      "value": "Server-side rendering betekent nul layoutverschuiving en perfecte indexeerbaarheid."
    },
    {
      "op": "set",
      "path": "blocks.steps-diff.copy.items.1.body",
      "value": "Automatische JSON-LD-injectie helpt je de zoekresultaten te domineren."
    },
    {
      "op": "set",
      "path": "blocks.steps-diff.copy.items.2.body",
      "value": "Verwijs gebruikers naar het specifieke antwoord dat ze nodig hebben met een stabiele URL."
    },
    {
      "op": "set",
      "path": "blocks.big-bang.copy.headline",
      "value": "Gebouwd voor het volgende decennium"
    },
    {
      "op": "set",
      "path": "blocks.big-bang.copy.body",
      "value": "Een levende kennisbank die met je meegroeit."
    },
    {
      "op": "set",
      "path": "blocks.steps-eco.copy.title",
      "value": "Slimmer bij elke interactie"
    },
    {
      "op": "set",
      "path": "blocks.steps-eco.copy.subhead",
      "value": "Het Clickeen-ecosysteem."
    },
    {
      "op": "set",
      "path": "blocks.steps-eco.copy.items.0.title",
      "value": "Foutbestendig"
    },
    {
      "op": "set",
      "path": "blocks.steps-eco.copy.items.1.title",
      "value": "Onveranderlijk"
    },
    {
      "op": "set",
      "path": "blocks.steps-eco.copy.items.2.title",
      "value": "Edge-gecached"
    },
    {
      "op": "set",
      "path": "blocks.steps-eco.copy.items.0.body",
      "value": "Elke wijziging wordt geversioneerd. Zet direct terug als je iets kapotmaakt."
    },
    {
      "op": "set",
      "path": "blocks.steps-eco.copy.items.1.body",
      "value": "Wat je publiceert is precies wat zij zien. Geen verrassingen."
    },
    {
      "op": "set",
      "path": "blocks.steps-eco.copy.items.2.body",
      "value": "Milliseconden tellen. We leveren antwoorden vanaf de locatie die het dichtst bij je gebruiker is."
    },
    {
      "op": "set",
      "path": "blocks.control-moat.copy.title",
      "value": "Design vereist meestal compromissen. Hier niet."
    },
    {
      "op": "set",
      "path": "blocks.control-moat.copy.subhead",
      "value": "Geen compromissen op esthetiek."
    },
    {
      "op": "set",
      "path": "blocks.control-moat.copy.items.0.title",
      "value": "Layouts"
    },
    {
      "op": "set",
      "path": "blocks.control-moat.copy.items.1.title",
      "value": "Typografie"
    },
    {
      "op": "set",
      "path": "blocks.control-moat.copy.items.2.title",
      "value": "Thema’s"
    },
    {
      "op": "set",
      "path": "blocks.control-moat.copy.items.0.body",
      "value": "Flexibele structuren."
    },
    {
      "op": "set",
      "path": "blocks.control-moat.copy.items.1.body",
      "value": "Volledige controle over lettertypen."
    },
    {
      "op": "set",
      "path": "blocks.control-moat.copy.items.2.body",
      "value": "Ondersteuning voor donker-/lichtmodus."
    },
    {
      "op": "set",
      "path": "blocks.global-moat.copy.title",
      "value": "Performance is een feature"
    },
    {
      "op": "set",
      "path": "blocks.global-moat.copy.subhead",
      "value": "Snelheid die meereist."
    },
    {
      "op": "set",
      "path": "blocks.global-moat.copy.items.0.title",
      "value": "Edge-caching"
    },
    {
      "op": "set",
      "path": "blocks.global-moat.copy.items.1.title",
      "value": "L10n"
    },
    {
      "op": "set",
      "path": "blocks.global-moat.copy.items.2.title",
      "value": "SEO"
    },
    {
      "op": "set",
      "path": "blocks.global-moat.copy.items.0.body",
      "value": "Levering in onder een milliseconde."
    },
    {
      "op": "set",
      "path": "blocks.global-moat.copy.items.1.body",
      "value": "Ondersteuning voor moedertalen."
    },
    {
      "op": "set",
      "path": "blocks.global-moat.copy.items.2.body",
      "value": "Geoptimaliseerd voor zoekmachines."
    },
    {
      "op": "set",
      "path": "blocks.platform-strip.copy.title",
      "value": "Ontworpen voor uitmuntendheid"
    },
    {
      "op": "set",
      "path": "blocks.platform-strip.copy.subhead",
      "value": "De technische basis van de beste sites ter wereld."
    },
    {
      "op": "set",
      "path": "blocks.platform-strip.copy.items.0.title",
      "value": "SoC 2"
    },
    {
      "op": "set",
      "path": "blocks.platform-strip.copy.items.1.title",
      "value": "99,99%"
    },
    {
      "op": "set",
      "path": "blocks.platform-strip.copy.items.2.title",
      "value": "Wereldwijd"
    },
    {
      "op": "set",
      "path": "blocks.platform-strip.copy.items.0.body",
      "value": "Enterprise-compliance."
    },
    {
      "op": "set",
      "path": "blocks.platform-strip.copy.items.1.body",
      "value": "SLA voor hoge beschikbaarheid."
    },
    {
      "op": "set",
      "path": "blocks.platform-strip.copy.items.2.body",
      "value": "Multi-region deployment."
    },
    {
      "op": "set",
      "path": "blocks.cta.copy.headline",
      "value": "Upgrade je antwoorden"
    },
    {
      "op": "set",
      "path": "blocks.cta.copy.subheadline",
      "value": "Begin vandaag nog met je gratis proefperiode."
    }
  ],
  "v": 1
}
