{
  "baseFingerprint": "ce3406e8218797e114aca1052dc141ca8afe3a247a3f3ac0d370a80459c001ff",
  "baseUpdatedAt": "2026-02-04T15:59:12.732Z",
  "ops": [
    {
      "op": "set",
      "path": "blocks.page-meta.copy.title",
      "value": "Nedtællingswidget – Clickeen"
    },
    {
      "op": "set",
      "path": "blocks.page-meta.copy.description",
      "value": "Skab hastværk med tilpasselige nedtællingstimere. Lancér, sælg og annoncer med ro i sindet."
    },
    {
      "op": "set",
      "path": "blocks.hero.copy.headline",
      "value": "Nedtællingswidget"
    },
    {
      "op": "set",
      "path": "blocks.hero.copy.subheadline",
      "value": "Skab hastværk og få brugerne til at handle med hurtige, fleksible nedtællinger."
    },
    {
      "op": "set",
      "path": "blocks.navmeta.copy.title",
      "value": "Nedtælling"
    },
    {
      "op": "set",
      "path": "blocks.navmeta.copy.description",
      "value": "Skab en følelse af hast med fleksible timere."
    },
    {
      "op": "set",
      "path": "blocks.minibob.copy.heading",
      "value": "Prøv det live"
    },
    {
      "op": "set",
      "path": "blocks.minibob.copy.subhead",
      "value": "Rediger en demo-instans i minibob. Udgiv, når du er klar."
    },
    {
      "op": "set",
      "path": "blocks.split-right.copy.headline",
      "value": "Widget til nedtællingstimer"
    },
    {
      "op": "set",
      "path": "blocks.split-right.copy.subheadline",
      "value": "Skab hastværk og få brugerne til at handle med nedtællingstimere, der kan tilpasses."
    },
    {
      "op": "set",
      "path": "blocks.split-left.copy.headline",
      "value": "Fleksible timer-tilstande"
    },
    {
      "op": "set",
      "path": "blocks.split-left.copy.subheadline",
      "value": "Datobaserede, personlige eller nummer-tællere til enhver situation."
    },
    {
      "op": "set",
      "path": "blocks.big-bang.copy.headline",
      "value": "Omsæt opmærksomhed til handling"
    },
    {
      "op": "set",
      "path": "blocks.big-bang.copy.body",
      "value": "Brug timere, der passer til lanceringer, udsalg, events og personlige mål. Indstil den én gang, og lad den køre overalt."
    },
    {
      "op": "set",
      "path": "blocks.split-stacked.copy.headline",
      "value": "Nem tilpasning"
    },
    {
      "op": "set",
      "path": "blocks.split-stacked.copy.subheadline",
      "value": "Tilpas udseende, layout og handlinger, så det passer til dit brand."
    },
    {
      "op": "set",
      "path": "blocks.steps.copy.title",
      "value": "Lancér hurtigere med nedtællinger"
    },
    {
      "op": "set",
      "path": "blocks.steps.copy.subhead",
      "value": "Fra opsætning til publicering på få minutter."
    },
    {
      "op": "set",
      "path": "blocks.steps.copy.items.0.title",
      "value": "Vælg din timer"
    },
    {
      "op": "set",
      "path": "blocks.steps.copy.items.1.title",
      "value": "Match dit brand"
    },
    {
      "op": "set",
      "path": "blocks.steps.copy.items.2.title",
      "value": "Publicér og lokaliser"
    },
    {
      "op": "set",
      "path": "blocks.steps.copy.items.0.body",
      "value": "Vælg dato-, evergreen- eller tælleværkstællere til dit behov."
    },
    {
      "op": "set",
      "path": "blocks.steps.copy.items.1.body",
      "value": "Tilpas farver, etiketter og layout, så det passer til ethvert site."
    },
    {
      "op": "set",
      "path": "blocks.steps.copy.items.2.body",
      "value": "Gå hurtigt i luften og nå globale målgrupper med indbygget lokalisering."
    },
    {
      "op": "set",
      "path": "blocks.split-right-2.copy.headline",
      "value": "Øg konverteringerne"
    },
    {
      "op": "set",
      "path": "blocks.split-right-2.copy.subheadline",
      "value": "Tilskynd til øjeblikkelig handling med tidsbegrænsede tilbud."
    },
    {
      "op": "set",
      "path": "blocks.split-left-2.copy.headline",
      "value": "SEO- og GEO-optimeret"
    },
    {
      "op": "set",
      "path": "blocks.split-left-2.copy.subheadline",
      "value": "Indbygget understøttelse af schema og lokalisering."
    },
    {
      "op": "set",
      "path": "blocks.cta.copy.headline",
      "value": "Skab hastværk, øg salget"
    },
    {
      "op": "set",
      "path": "blocks.cta.copy.subheadline",
      "value": "Kraftfulde nedtællingstimere, der konverterer besøgende til kunder."
    }
  ],
  "v": 1
}
