{
  "baseFingerprint": "078cf942c2ec402acbdcfac44cbe3012de31ea3f3ba6c27e920350ac8b806136",
  "baseUpdatedAt": "2026-02-12T04:40:38.065008+00:00",
  "ops": [
    {
      "op": "set",
      "path": "cta.label",
      "value": "Зв’язатися з Ive Engineering"
    },
    {
      "op": "set",
      "path": "header.subtitleHtml",
      "value": "Ваш надійний партнер у сфері інженерних рішень і послуг."
    },
    {
      "op": "set",
      "path": "header.title",
      "value": "FAQ Ive Engineering"
    },
    {
      "op": "set",
      "path": "sections.0.faqs.0.answer",
      "value": "Ive Engineering — міжнародна компанія, що спеціалізується на інноваційних інженерних рішеннях і послугах."
    },
    {
      "op": "set",
      "path": "sections.0.faqs.0.question",
      "value": "Що таке Ive Engineering?"
    },
    {
      "op": "set",
      "path": "sections.0.faqs.1.answer",
      "value": "Просто зв’яжіться з нами, обговоріть потреби вашого проєкту — і ми допоможемо підібрати оптимальні послуги."
    },
    {
      "op": "set",
      "path": "sections.0.faqs.1.question",
      "value": "Як розпочати користуватися послугами Ive Engineering?"
    },
    {
      "op": "set",
      "path": "sections.0.faqs.2.answer",
      "value": "Так, Ive Engineering пропонує безкоштовні консультації, щоб краще зрозуміти вимоги вашого проєкту."
    },
    {
      "op": "set",
      "path": "sections.0.faqs.2.question",
      "value": "Чи доступна консультація?"
    },
    {
      "op": "set",
      "path": "sections.0.faqs.3.answer",
      "value": "Ive Engineering пропонує передові рішення, команду досвідчених фахівців і персоналізований сервіс під ваші конкретні інженерні завдання."
    },
    {
      "op": "set",
      "path": "sections.0.faqs.3.question",
      "value": "Чому варто обрати Ive Engineering для моїх інженерних потреб?"
    },
    {
      "op": "set",
      "path": "sections.0.title",
      "value": "Усі запитання"
    },
    {
      "op": "set",
      "path": "sections.0.faqs.4.answer",
      "value": "Ive Engineering цінує інновації, доброчесність і прагнення до досконалості в кожному проєкті та послузі."
    },
    {
      "op": "set",
      "path": "sections.0.faqs.4.question",
      "value": "Які ключові цінності Ive Engineering?"
    },
    {
      "op": "set",
      "path": "sections.0.faqs.5.answer",
      "value": "Зв’язатися з Ive Engineering можна через наш сайт, електронну пошту або за телефоном, указаними на сторінці контактів."
    },
    {
      "op": "set",
      "path": "sections.0.faqs.5.question",
      "value": "Як зв’язатися з Ive Engineering?"
    }
  ],
  "v": 1
}
