{
  "baseFingerprint": "3e6f1047c7b081db7fc5199dfa3b42789a3160f60727d4cdccbaf73f65a4e282",
  "baseUpdatedAt": "2026-02-04T05:27:21.891Z",
  "ops": [
    {
      "op": "set",
      "path": "blocks.page-meta.copy.title",
      "value": "Modèles de FAQ - Clickeen"
    },
    {
      "op": "set",
      "path": "blocks.page-meta.copy.description",
      "value": "Choisissez parmi de superbes designs de FAQ qui attirent l’attention et convertissent les visiteurs."
    },
    {
      "op": "set",
      "path": "blocks.hero.copy.headline",
      "value": "Votre FAQ. À votre façon."
    },
    {
      "op": "set",
      "path": "blocks.hero.copy.subheadline",
      "value": "Beau par défaut. Inimitablement à vous par conception."
    },
    {
      "op": "set",
      "path": "blocks.split-2026-trends.copy.headline",
      "value": "Audacieux quand il le faut"
    },
    {
      "op": "set",
      "path": "blocks.split-2026-trends.copy.subheadline",
      "value": "Glassmorphism, liquid glass, neumorphism — des looks à la pointe des tendances en clair comme en sombre."
    },
    {
      "op": "set",
      "path": "blocks.split-evergreen-styles.copy.headline",
      "value": "Élégant quand vous le souhaitez"
    },
    {
      "op": "set",
      "path": "blocks.split-evergreen-styles.copy.subheadline",
      "value": "Minimal, épuré et moderne. Des styles intemporels qui paraissent toujours actuels."
    },
    {
      "op": "set",
      "path": "blocks.big-bang-freedom.copy.headline",
      "value": "Commencez avec un design. Puis faites-le vôtre."
    },
    {
      "op": "set",
      "path": "blocks.big-bang-freedom.copy.body",
      "value": "Adoptez l’esthétique instantanément. Des designs tendance ou des classiques intemporels. Ensuite, personnalisez sans limites — rayon par coin, ombres par côté, typographie par rôle et points de rupture responsives. Un modèle qui devient votre signature."
    },
    {
      "op": "set",
      "path": "blocks.navmeta.copy.title",
      "value": "FAQ"
    },
    {
      "op": "set",
      "path": "blocks.navmeta.copy.description",
      "value": "Aidez les visiteurs à trouver rapidement des réponses."
    },
    {
      "op": "set",
      "path": "blocks.steps-customization.copy.title",
      "value": "La liberté de design, intégrée."
    },
    {
      "op": "set",
      "path": "blocks.steps-customization.copy.subhead",
      "value": "Des mises en page aux finitions en passant par les polices — une personnalisation qui semble sans effort."
    },
    {
      "op": "set",
      "path": "blocks.steps-customization.copy.items.0.title",
      "value": "Des mises en page, à votre façon"
    },
    {
      "op": "set",
      "path": "blocks.steps-customization.copy.items.1.title",
      "value": "Un contrôle de l’apparence sans limites"
    },
    {
      "op": "set",
      "path": "blocks.steps-customization.copy.items.2.title",
      "value": "Une typographie d’une précision inégalée"
    },
    {
      "op": "set",
      "path": "blocks.steps-customization.copy.items.0.body",
      "value": "De nombreux systèmes de mise en page, pas un seul. Structure par point de rupture. Marges intérieures et espacement indépendants sur ordinateur/mobile. Contrôlez les colonnes, l’empilement, l’alignement et le réagencement — précisément."
    },
    {
      "op": "set",
      "path": "blocks.steps-customization.copy.items.1.body",
      "value": "Rayon par coin. Bordures avec couleurs personnalisées. Ombres externes et internes (liées ou indépendantes par côté). Arrière-plans en dégradé, image ou vidéo. Une maîtrise visuelle totale."
    },
    {
      "op": "set",
      "path": "blocks.steps-customization.copy.items.2.body",
      "value": "Six rôles distincts (titre, corps, question, réponse, bouton, section). Choisissez parmi 17 Google Fonts. Graisse, style, taille — tout est personnalisable par rôle. Échelles dynamiques."
    },
    {
      "op": "set",
      "path": "blocks.split-layouts.copy.headline",
      "value": "Trois moteurs de mise en page pour votre widget FAQ"
    },
    {
      "op": "set",
      "path": "blocks.split-layouts.copy.subheadline",
      "value": "Accordéon pour une révélation progressive. Liste pour la simplicité. Cartes pour une hiérarchie visuelle. Grille ou maçonnerie. Colonnes responsives. Contrôle granulaire des espacements et des marges intérieures."
    },
    {
      "op": "set",
      "path": "blocks.split-appearance.copy.headline",
      "value": "Contrôle de l’apparence sans limites"
    },
    {
      "op": "set",
      "path": "blocks.split-appearance.copy.subheadline",
      "value": "Rayon par coin. Bordures avec des couleurs personnalisées. Ombres extérieures et intérieures (liées ou indépendantes par côté). Arrière-plans en dégradé, image ou vidéo. Contrôle visuel total."
    },
    {
      "op": "set",
      "path": "blocks.split-typography.copy.headline",
      "value": "Précision typographique"
    },
    {
      "op": "set",
      "path": "blocks.split-typography.copy.subheadline",
      "value": "Six rôles distincts (titre, corps, question, réponse, bouton, section). Choisissez parmi 17 polices Google Fonts. Graisse, style, taille — tout est personnalisable par rôle. Échelles dynamiques."
    },
    {
      "op": "set",
      "path": "blocks.split-dark.copy.headline",
      "value": "Mode sombre : sophistiqué et moderne"
    },
    {
      "op": "set",
      "path": "blocks.split-dark.copy.subheadline",
      "value": "Les interfaces modernes s’épanouissent dans l’obscurité. Une sensation premium avec une esthétique à la pointe. Inclus avec chaque template."
    },
    {
      "op": "set",
      "path": "blocks.split-responsive.copy.headline",
      "value": "Ordinateur et mobile, parfaitement optimisés"
    },
    {
      "op": "set",
      "path": "blocks.split-responsive.copy.subheadline",
      "value": "Votre widget FAQ s’adapte à chaque point de rupture. Différents nombres de colonnes, marges intérieures et espacements selon l’appareil. Un langage de design, une infinité d’affichages."
    },
    {
      "op": "set",
      "path": "blocks.steps-workflow.copy.title",
      "value": "Du modèle à l’ajustement parfait"
    },
    {
      "op": "set",
      "path": "blocks.steps-workflow.copy.subhead",
      "value": "Comment créer votre widget FAQ"
    },
    {
      "op": "set",
      "path": "blocks.steps-workflow.copy.items.0.title",
      "value": "Choisissez un modèle de design"
    },
    {
      "op": "set",
      "path": "blocks.steps-workflow.copy.items.1.title",
      "value": "Personnalisez la mise en page et l’apparence"
    },
    {
      "op": "set",
      "path": "blocks.steps-workflow.copy.items.2.title",
      "value": "Affinez la typographie et l’adaptation responsive"
    },
    {
      "op": "set",
      "path": "blocks.steps-workflow.copy.items.0.body",
      "value": "Tendance, classique ou minimal. Modes clair et sombre."
    },
    {
      "op": "set",
      "path": "blocks.steps-workflow.copy.items.1.body",
      "value": "Accordéon, liste ou cartes. Rayon par coin, ombres par côté, dégradés, bordures."
    },
    {
      "op": "set",
      "path": "blocks.steps-workflow.copy.items.2.body",
      "value": "Six rôles typographiques, 17 polices Google Fonts. Parfait sur ordinateur et mobile."
    },
    {
      "op": "set",
      "path": "blocks.cta-templates.copy.headline",
      "value": "Créez un widget FAQ gratuit"
    },
    {
      "op": "set",
      "path": "blocks.cta-templates.copy.subheadline",
      "value": "Commencez avec un modèle de design ou créez à partir de zéro. Contrôle créatif total."
    }
  ],
  "v": 1
}
