{
  "baseFingerprint": "1402da709a7660c213d7e0f97fe20472d192bbaaaa572c0ed23f7b074064a626",
  "baseUpdatedAt": "2026-02-04T05:36:55.819Z",
  "ops": [
    {
      "op": "set",
      "path": "blocks.page-meta.copy.title",
      "value": "Logo-Showcase-Vorlagen – Clickeen"
    },
    {
      "op": "set",
      "path": "blocks.page-meta.copy.description",
      "value": "Beginnen Sie mit einem ausgefeilten Layout und passen Sie Ihr Logo-Showcase an."
    },
    {
      "op": "set",
      "path": "blocks.hero.copy.headline",
      "value": "Logo-Showcase-Vorlagen"
    },
    {
      "op": "set",
      "path": "blocks.hero.copy.subheadline",
      "value": "Beginnen Sie mit einem ausgefeilten Layout – und machen Sie es dann zu Ihrem."
    }
  ],
  "v": 1
}
