{
  "baseFingerprint": "f4ef885ddc66b7ad0239e90a1ca4dc0bf53a9cb757d66e3396d439606404d4ae",
  "baseUpdatedAt": "2026-02-12T04:20:28.079031+00:00",
  "ops": [
    {
      "op": "set",
      "path": "sections.0.title",
      "value": "सभी प्रश्न"
    },
    {
      "op": "set",
      "path": "sections.0.faqs.0.question",
      "value": "Liquid Marketing क्या है?"
    },
    {
      "op": "set",
      "path": "sections.0.faqs.1.question",
      "value": "मैं Liquid Marketing का उपयोग शुरू कैसे करूँ?"
    },
    {
      "op": "set",
      "path": "sections.0.faqs.2.question",
      "value": "क्या कोई फ्री ट्रायल उपलब्ध है?"
    },
    {
      "op": "set",
      "path": "sections.0.faqs.3.question",
      "value": "मेरी मार्केटिंग ज़रूरतों के लिए मुझे Liquid Marketing क्यों चुनना चाहिए?"
    },
    {
      "op": "set",
      "path": "sections.0.faqs.0.answer",
      "value": "Liquid Marketing एक SaaS कंपनी है जो मार्केटिंग ऑटोमेशन में विशेषज्ञ है—यह ईमेल कैंपेन, कस्टमर सेगमेंटेशन और एनालिटिक्स के लिए उन्नत टूल्स प्रदान करती है।"
    },
    {
      "op": "set",
      "path": "sections.0.faqs.1.answer",
      "value": "बस साइन अप करें, अपना डेटा इंटीग्रेट करें और हमारे सहज प्लेटफ़ॉर्म के साथ ऑटोमेटेड कैंपेन बनाना शुरू करें।"
    },
    {
      "op": "set",
      "path": "sections.0.faqs.2.answer",
      "value": "हाँ, Liquid Marketing बेसिक फीचर्स के साथ एक फ्री ट्रायल देता है। अधिक उन्नत क्षमताओं के लिए अपग्रेड करें।"
    },
    {
      "op": "set",
      "path": "sections.0.faqs.3.answer",
      "value": "Liquid Marketing एक मज़बूत प्लेटफ़ॉर्म देता है जिसमें उपयोग में आसान ऑटोमेशन टूल्स, विस्तृत एनालिटिक्स और बेहतरीन कस्टमर सपोर्ट शामिल हैं—यह उन व्यवसायों के लिए आदर्श है जो अपनी मार्केटिंग को सरल और अधिक प्रभावी बनाना चाहते हैं।"
    },
    {
      "op": "set",
      "path": "cta.label",
      "value": "हमसे संपर्क करें "
    },
    {
      "op": "set",
      "path": "header.subtitleHtml",
      "value": "यहाँ सबसे अधिक पूछे जाने वाले सवालों के जवाब पाएँ।"
    },
    {
      "op": "set",
      "path": "header.title",
      "value": "अक्सर पूछे जाने वाले प्रश्न"
    }
  ],
  "v": 1
}
