{
  "baseFingerprint": "94e54adc93e738aaf20f184540089ee27bca924f32ee83c8b3427ade53ec9e00",
  "baseUpdatedAt": "2026-02-12T17:01:21.211684+00:00",
  "ops": [
    {
      "op": "set",
      "path": "cta.label",
      "value": "Buat reservasi"
    },
    {
      "op": "set",
      "path": "header.subtitleHtml",
      "value": "Temukan pesona dan kenyamanan B&B kami di USA."
    },
    {
      "op": "set",
      "path": "header.title",
      "value": "FAQ Galeri Seni Soho"
    },
    {
      "op": "set",
      "path": "sections.0.faqs.0.answer",
      "value": "Kami menampilkan seni kontemporer dari <a href=\"https://www.clickeen.com/\" class=\"diet-dropdown-edit-link\"></a><a href=\"https://www.clickeen.com/\" class=\"diet-dropdown-edit-link\"></a><a href=\"https://www.clickeen.com/\" class=\"diet-dropdown-edit-link\"></a><a href=\"https://www.clickeen.com/\" class=\"diet-dropdown-edit-link\"></a><a href=\"https://www.clickeen.com/\" class=\"diet-dropdown-edit-link\">seniman lokal</a> dan i<a href=\"https://www.clickeen.com/\" class=\"diet-dropdown-edit-link\"></a><a href=\"https://www.clickeen.com/\" class=\"diet-dropdown-edit-link\"></a><a href=\"https://www.clickeen.com/\" class=\"diet-dropdown-edit-link\"></a><a href=\"https://www.clickeen.com/\" class=\"diet-dropdown-edit-link\"></a><a href=\"https://www.clickeen.com/\" class=\"diet-dropdown-edit-link\">nternasional</a>."
    },
    {
      "op": "set",
      "path": "sections.0.faqs.0.question",
      "value": "Jenis karya seni apa yang dipamerkan?"
    },
    {
      "op": "set",
      "path": "sections.0.faqs.1.answer",
      "value": "Galeri buka Selasa hingga Minggu, pukul 10.00â€“18.00."
    },
    {
      "op": "set",
      "path": "sections.0.faqs.1.question",
      "value": "Jam buka galeri?"
    },
    {
      "op": "set",
      "path": "sections.0.faqs.2.answer",
      "value": "Tiket masuk gratis, namun donasi sangat kami apresiasi."
    },
    {
      "op": "set",
      "path": "sections.0.faqs.2.question",
      "value": "Apakah ada biaya masuk?"
    },
    {
      "op": "set",
      "path": "sections.0.faqs.3.answer",
      "value": "Ya, Anda bisa membeli karya seni langsung dari galeri."
    },
    {
      "op": "set",
      "path": "sections.0.faqs.3.question",
      "value": "Apakah saya bisa membeli karya seni di galeri?"
    },
    {
      "op": "set",
      "path": "sections.0.faqs.4.answer",
      "value": "Cek situs web kami untuk info pameran dan acara yang akan datang."
    },
    {
      "op": "set",
      "path": "sections.0.faqs.4.question",
      "value": "Apakah ada acara mendatang?"
    },
    {
      "op": "set",
      "path": "sections.0.faqs.5.answer",
      "value": "Ya, kami menyediakan penyewaan untuk acara privat dengan biaya."
    },
    {
      "op": "set",
      "path": "sections.0.faqs.5.question",
      "value": "Bisakah saya mengadakan acara privat di galeri?"
    },
    {
      "op": "set",
      "path": "sections.0.title",
      "value": "Informasi Galeri"
    }
  ],
  "v": 1
}
