{
  "baseFingerprint": "368496d1d6e5f2bc9b25a99d454000245c4c1eb0f7379e02f3364b21d3894579",
  "baseUpdatedAt": "2026-02-07T02:33:07.074Z",
  "ops": [
    {
      "op": "set",
      "path": "blocks.page-meta.copy.title",
      "value": "เทมเพลต FAQ - Clickeen"
    },
    {
      "op": "set",
      "path": "blocks.page-meta.copy.description",
      "value": "เริ่มต้นด้วยเทมเพลต FAQ ที่ออกแบบโดยมืออาชีพ ปรับแต่งได้ทุกอย่าง"
    },
    {
      "op": "set",
      "path": "blocks.hero.copy.headline",
      "value": "วิดเจ็ตเดียว ฟีลได้ไม่รู้จบ"
    },
    {
      "op": "set",
      "path": "blocks.hero.copy.subheadline",
      "value": "ตั้งแต่กลาสมอร์ฟิซึมที่กำลังมาแรงไปจนถึงคลาสสิกเหนือกาลเวลา สลับสไตล์ได้ทันทีโดยไม่ต้องแตะเนื้อหา"
    },
    {
      "op": "set",
      "path": "blocks.split-trends.copy.headline",
      "value": "วิดเจ็ตเดียว ฟีลได้ไม่รู้จบ"
    },
    {
      "op": "set",
      "path": "blocks.split-trends.copy.subheadline",
      "value": "ตั้งแต่กลาสมอร์ฟิซึมที่กำลังมาแรงไปจนถึงคลาสสิกเหนือกาลเวลา สลับสไตล์ได้ทันทีโดยไม่ต้องแตะเนื้อหา"
    },
    {
      "op": "set",
      "path": "blocks.big-bang.copy.headline",
      "value": "โหมดสว่าง โหมดมืด โหมดไหนก็ได้ นี่คือโหมดของคุณ"
    },
    {
      "op": "set",
      "path": "blocks.big-bang.copy.body",
      "value": "เทมเพลตเป็นแค่เส้นสตาร์ต คุณเป็นคนกำหนดเส้นชัย"
    },
    {
      "op": "set",
      "path": "blocks.control-moat.copy.title",
      "value": "อิสระด้านดีไซน์ มีมาให้ในตัว"
    },
    {
      "op": "set",
      "path": "blocks.control-moat.copy.subhead",
      "value": "ตั้งแต่เลย์เอาต์ไปจนถึงฟินิชและฟอนต์—การปรับแต่งที่รู้สึก effortless"
    },
    {
      "op": "set",
      "path": "blocks.control-moat.copy.items.0.title",
      "value": "เลย์เอาต์ ในแบบของคุณ"
    },
    {
      "op": "set",
      "path": "blocks.control-moat.copy.items.1.title",
      "value": "ควบคุมรูปลักษณ์ได้แบบไร้ขีดจำกัด"
    },
    {
      "op": "set",
      "path": "blocks.control-moat.copy.items.2.title",
      "value": "ความแม่นยำด้านตัวอักษร"
    },
    {
      "op": "set",
      "path": "blocks.control-moat.copy.items.0.body",
      "value": "มีหลายระบบเลย์เอาต์ ไม่ใช่แค่แบบเดียว โครงสร้างแยกตามเบรกพอยต์ ระยะ padding และ spacing แยกเดสก์ท็อป/มือถือ ควบคุมคอลัมน์ การซ้อน การจัดแนว และการ reflow—ได้อย่างแม่นยำ"
    },
    {
      "op": "set",
      "path": "blocks.control-moat.copy.items.1.body",
      "value": "กำหนดรัศมีมุมแยกแต่ละมุม เส้นขอบพร้อมสีที่กำหนดเอง เงาด้านนอกและด้านใน (ลิงก์กันหรือแยกตามแต่ละด้าน) พื้นหลังแบบไล่เฉด รูปภาพ หรือวิดีโอ อำนาจการควบคุมภาพล้วนๆ"
    },
    {
      "op": "set",
      "path": "blocks.control-moat.copy.items.2.body",
      "value": "6 บทบาทที่แตกต่าง (หัวข้อ เนื้อหา คำถาม คำตอบ ปุ่ม เซกชัน) เลือกจาก Google Fonts 17 แบบ น้ำหนัก สไตล์ ขนาด—ปรับแต่งได้ตามบทบาท สเกลแบบไดนามิก"
    },
    {
      "op": "set",
      "path": "blocks.split-layouts.copy.headline",
      "value": "สลับเอนจินได้ทันที"
    },
    {
      "op": "set",
      "path": "blocks.split-layouts.copy.subheadline",
      "value": "Grid, List หรือ Accordion"
    },
    {
      "op": "set",
      "path": "blocks.split-appearance.copy.headline",
      "value": "มี Interaction design ให้แล้ว"
    },
    {
      "op": "set",
      "path": "blocks.split-appearance.copy.subheadline",
      "value": "สถานะโฮเวอร์ สถานะแอคทีฟ วงแหวนโฟกัส"
    },
    {
      "op": "set",
      "path": "blocks.split-typography.copy.headline",
      "value": "ตัวอักษรที่ใช่"
    },
    {
      "op": "set",
      "path": "blocks.split-typography.copy.subheadline",
      "value": "ใช้ฟอนต์ของคุณเองหรือเลือกจากคลังของเรา"
    },
    {
      "op": "set",
      "path": "blocks.split-darkmode.copy.headline",
      "value": "โหมดมืดทำงานอัตโนมัติ"
    },
    {
      "op": "set",
      "path": "blocks.split-darkmode.copy.subheadline",
      "value": "มันทำงานได้เลย"
    },
    {
      "op": "set",
      "path": "blocks.split-responsive.copy.headline",
      "value": "มือถือที่สมบูรณ์แบบ"
    },
    {
      "op": "set",
      "path": "blocks.split-responsive.copy.subheadline",
      "value": "ขนาดพื้นที่แตะที่ใช้งานได้จริง"
    },
    {
      "op": "set",
      "path": "blocks.steps.copy.title",
      "value": "สร้าง FAQ แบบเนทีฟของคุณ"
    },
    {
      "op": "set",
      "path": "blocks.steps.copy.subhead",
      "value": "จากไอเดียสู่ไลฟ์ในสามขั้นตอน"
    },
    {
      "op": "set",
      "path": "blocks.steps.copy.items.0.title",
      "value": "เลือกพื้นฐาน"
    },
    {
      "op": "set",
      "path": "blocks.steps.copy.items.1.title",
      "value": "ปรับจูนรายละเอียด"
    },
    {
      "op": "set",
      "path": "blocks.steps.copy.items.2.title",
      "value": "ปล่อยขึ้นใช้งาน"
    },
    {
      "op": "set",
      "path": "blocks.steps.copy.items.0.body",
      "value": "เลือกเทมเพลตที่เข้ากับฟีลของคุณ"
    },
    {
      "op": "set",
      "path": "blocks.steps.copy.items.1.body",
      "value": "ปรับสีและระยะห่างในตัวแก้ไขแบบภาพ"
    },
    {
      "op": "set",
      "path": "blocks.steps.copy.items.2.body",
      "value": "โค้ดฝังเดียว ใช้งานได้ทุกที่"
    },
    {
      "op": "set",
      "path": "blocks.cta.copy.headline",
      "value": "ถึงเวลาสร้างแล้ว"
    },
    {
      "op": "set",
      "path": "blocks.cta.copy.subheadline",
      "value": "เริ่มต้นด้วยเทมเพลตฟรี"
    }
  ],
  "v": 1
}
