{
  "baseFingerprint": "20ff085a87cf392db7a7f66fab728b113e0a03c3ccd63c3eecb968b9b168d46c",
  "baseUpdatedAt": "2026-01-30T18:14:23.393Z",
  "ops": [
    {
      "op": "set",
      "path": "blocks.page-meta.copy.title",
      "value": "FAQ विजेट - Clickeen"
    },
    {
      "op": "set",
      "path": "blocks.page-meta.copy.description",
      "value": "तेज़, सुंदर FAQ विजेट बनाएँ। मिनटों में कस्टमाइज़ करें, प्रकाशित करें और स्थानीयकरण करें।"
    },
    {
      "op": "set",
      "path": "blocks.hero.copy.headline",
      "value": "FAQs विजेट। सुंदर जवाब। तेज़ी के लिए बनाया गया।"
    },
    {
      "op": "set",
      "path": "blocks.hero.copy.subheadline",
      "value": "परिष्कृत डिज़ाइन, सहज अपडेट, और SEO की बुनियाद—किसी भी भाषा के लिए तैयार, AI द्वारा संचालित।"
    },
    {
      "op": "set",
      "path": "blocks.navmeta.copy.title",
      "value": "अक्सर पूछे जाने वाले प्रश्न"
    },
    {
      "op": "set",
      "path": "blocks.navmeta.copy.description",
      "value": "आगंतुकों को जल्दी उत्तर ढूँढने में मदद करें।"
    },
    {
      "op": "set",
      "path": "blocks.minibob.copy.heading",
      "value": "इसे अपना बनाएं"
    },
    {
      "op": "set",
      "path": "blocks.minibob.copy.subhead",
      "value": "अपना परफ़ेक्ट FAQ यहीं डिज़ाइन करें। बदलाव तुरंत देखें।"
    },
    {
      "op": "set",
      "path": "blocks.split-right.copy.headline",
      "value": "विभाजित क्रिएटिव (दाएँ)"
    },
    {
      "op": "set",
      "path": "blocks.split-right.copy.subheadline",
      "value": "यह दाएँ-विज़ुअल वैरिएंट है, जो हीरो के समान क्यूरेटेड इंस्टेंस का उपयोग करता है।"
    },
    {
      "op": "set",
      "path": "blocks.split-left.copy.headline",
      "value": "स्प्लिट क्रिएटिव (बाएँ)"
    },
    {
      "op": "set",
      "path": "blocks.split-left.copy.subheadline",
      "value": "यह बाएँ-विज़ुअल वैरिएंट है, जिसमें हीरो के समान क्यूरेटेड इंस्टेंस का उपयोग किया गया है।"
    },
    {
      "op": "set",
      "path": "blocks.big-bang.copy.headline",
      "value": "देखें कि सवाल रियल-टाइम में अपने आप कैसे जवाब पाते हैं"
    },
    {
      "op": "set",
      "path": "blocks.big-bang.copy.body",
      "value": "एक खूबसूरती से डिज़ाइन किया गया FAQ जोड़ें जो संदेह के क्षण में सही जवाब सामने लाता है। ग्राहक तुरंत अटकने से बच जाते हैं, आपत्तियाँ टिकट बनने से पहले ही खत्म हो जाती हैं, और आप अधिक सपोर्ट जोड़े बिना ज़्यादा बिक्री बंद करते हैं। एक बार कस्टमाइज़ करें, कहीं भी एम्बेड करें, और इसे 24/7 काम करने दें।"
    },
    {
      "op": "set",
      "path": "blocks.split-stacked.copy.headline",
      "value": "विभाजित क्रिएटिव (स्टैक्ड)"
    },
    {
      "op": "set",
      "path": "blocks.split-stacked.copy.subheadline",
      "value": "यह स्टैक्ड वैरिएंट है, जिसमें हीरो के समान ही क्यूरेटेड इंस्टेंस का उपयोग किया गया है।"
    },
    {
      "op": "set",
      "path": "blocks.steps.copy.title",
      "value": "वास्तव में काम करने वाले FAQs (ताकि आपको न करना पड़े)"
    },
    {
      "op": "set",
      "path": "blocks.steps.copy.subhead",
      "value": "आपके ग्राहकों के सवाल होते हैं। उन्हें एक बार जवाब दें, सौ बार नहीं।"
    },
    {
      "op": "set",
      "path": "blocks.steps.copy.items.0.title",
      "value": "अनुत्तरित सवालों की वजह से बिक्री खोना बंद करें"
    },
    {
      "op": "set",
      "path": "blocks.steps.copy.items.1.title",
      "value": "अपना समय वापस पाएं"
    },
    {
      "op": "set",
      "path": "blocks.steps.copy.items.2.title",
      "value": "सोते हुए भी ज़्यादा डील्स क्लोज़ करें"
    },
    {
      "op": "set",
      "path": "blocks.steps.copy.items.0.body",
      "value": "हर सवाल जो अनुत्तरित रह जाता है, एक ग्राहक के दूर जाने जैसा है। जब विज़िटर को जो चाहिए वह नहीं मिलता, वे साइट छोड़ देते हैं। एक अच्छी तरह डिज़ाइन किया गया FAQ आपत्तियों को बनने से पहले ही खत्म कर देता है—ताकि ग्राहक बिना संपर्क किए खुद को खरीदने के लिए मना कर लें।"
    },
    {
      "op": "set",
      "path": "blocks.steps.copy.items.1.body",
      "value": "जब ग्राहक तुरंत जवाब पा लेते हैं, तो सपोर्ट वॉल्यूम 40%+ तक घटा दें। अब कोई Slack पिंग नहीं। अब कोई \"quick question\" ईमेल नहीं। अब कॉन्टेक्स्ट-स्विचिंग का नरक नहीं। आपका FAQ भारी काम संभालता है, जबकि आप उस काम पर ध्यान देते हैं जो सच में मायने रखता है।"
    },
    {
      "op": "set",
      "path": "blocks.steps.copy.items.2.body",
      "value": "सही FAQ 2 AM पर, जब आप ऑफ़लाइन होते हैं, संदेह का अंदाज़ा लगाता है और घर्षण हटाता है। आपके जवाब 24/7 काम करते हैं। ग्राहक आपका इंतज़ार नहीं करते—वे अटकाव से निकलते हैं, जो देखते हैं उस पर भरोसा करते हैं, और आपके दिन में बाधा डाले बिना \"buy\" पर क्लिक कर देते हैं।"
    },
    {
      "op": "set",
      "path": "blocks.split-right-2.copy.headline",
      "value": "स्प्लिट क्रिएटिव (दाएँ)"
    },
    {
      "op": "set",
      "path": "blocks.split-right-2.copy.subheadline",
      "value": "यह दाएँ-विज़ुअल वैरिएंट है, जो हीरो के समान ही क्यूरेटेड इंस्टेंस का उपयोग करता है।"
    },
    {
      "op": "set",
      "path": "blocks.split-left-2.copy.headline",
      "value": "स्प्लिट क्रिएटिव (बाएँ)"
    },
    {
      "op": "set",
      "path": "blocks.split-left-2.copy.subheadline",
      "value": "यह बाएँ-विज़ुअल वैरिएंट है, जो हीरो के समान क्यूरेटेड इंस्टेंस का उपयोग करता है।"
    },
    {
      "op": "set",
      "path": "blocks.cta.copy.headline",
      "value": "हर ग्राहक से, हर जगह जुड़ें"
    },
    {
      "op": "set",
      "path": "blocks.cta.copy.subheadline",
      "value": "AI-संचालित FAQ जो उनकी भाषा बोलता है और उनकी ज़रूरतों को समझता है।"
    }
  ],
  "v": 1
}
